{
  "completeness": {
    "counters": {
      "cold_gap_calls": 0,
      "drain_shortfall": 0,
      "dropped_events": 0,
      "dropped_events_bpf": 0,
      "dropped_events_userspace": 0,
      "engine_fallback_uninstrumented": 0,
      "fork_exec_ignored": 2,
      "missed_attaches": 0,
      "over_budget": 0,
      "provider_changed": 0,
      "scan_budget_exhaustions": 0,
      "table_staleness_events": 0,
      "uninstrumented_ops": 0,
      "unresolved_offsets": 0
    },
    "reasons": [
      "fork-exec-ignored"
    ],
    "status": "PARTIAL"
  },
  "drain_wall_us": 0,
  "executions": [],
  "kernel": "test-kernel",
  "legacy": null,
  "provider": {
    "build_id": "unknown",
    "path": "/p/provider.so"
  },
  "schema_version": "observed-crypto-v1.0",
  "stale": [],
  "target": {
    "cmdline": "t",
    "comm": "t",
    "container_id": "",
    "image_digest": "",
    "pid": 7
  },
  "window": {
    "actual_s": 1.0,
    "end_epoch": 1700000001.0,
    "planned_s": 1.0,
    "start_epoch": 1700000000.0
  }
}
