{
  "child_exit": 0,
  "completeness": {
    "counters": {
      "cold_gap_calls": 0,
      "drain_shortfall": 0,
      "dropped_events": 0,
      "dropped_events_bpf": 0,
      "dropped_events_userspace": 0,
      "engine_fallback_uninstrumented": 0,
      "fork_exec_ignored": 0,
      "missed_attaches": 0,
      "over_budget": 0,
      "provider_changed": 0,
      "scan_budget_exhaustions": 0,
      "table_staleness_events": 0,
      "uninstrumented_ops": 0,
      "unresolved_offsets": 0
    },
    "reasons": [],
    "status": "COMPLETE"
  },
  "drain_wall_us": 0,
  "executions": [
    {
      "alg_class": "SHA256",
      "aliases": [],
      "cookie": 1,
      "count": 1204033,
      "first_ns": 0,
      "funcid": 11,
      "last_ns": 0,
      "offset": 0,
      "op": 1,
      "provider": "default"
    },
    {
      "alg_class": "DES",
      "aliases": [],
      "cookie": 2,
      "count": 500,
      "first_ns": 0,
      "funcid": 21,
      "last_ns": 0,
      "offset": 0,
      "op": 2,
      "provider": "default"
    },
    {
      "alg_class": "other",
      "aliases": [],
      "cookie": 2,
      "count": 9,
      "first_ns": 0,
      "funcid": 22,
      "last_ns": 0,
      "offset": 0,
      "op": 2,
      "provider": "default"
    },
    {
      "alg_class": "RSA",
      "aliases": [],
      "cookie": 13,
      "count": 7,
      "first_ns": 0,
      "funcid": 31,
      "last_ns": 0,
      "offset": 0,
      "op": 13,
      "provider": "default"
    }
  ],
  "kernel": "test-kernel",
  "legacy": {
    "capability": {
      "syms_present": 10,
      "tripwires_attached": 8,
      "tripwires_missed": 2
    },
    "engine": {
      "calls_by_entrypoint": {
        "ENGINE_init": 5
      },
      "engine_id_class": {
        "builtin": 0,
        "dynamic": 1,
        "other": 0
      }
    },
    "entries": [
      {
        "class": "engine",
        "name": "ENGINE_init",
        "probed": true,
        "state": "observed"
      },
      {
        "class": "meth",
        "name": "RSA_meth_new",
        "probed": false,
        "state": "uninstrumented"
      },
      {
        "class": "lowlevel",
        "name": "SHA256_Update",
        "probed": true,
        "state": "absent"
      }
    ],
    "flags": [
      "engine-api-absent"
    ],
    "legacy_provider": {
      "algs": [
        "MD4"
      ],
      "executed_calls": 4,
      "loads": {
        "legacy": 1
      }
    },
    "weak": {
      "executed_algs": [
        "DES"
      ],
      "executed_calls": 500,
      "legacy_algs": [
        "MD4"
      ],
      "unknown_calls": 9
    }
  },
  "provider": {
    "build_id": "unknown",
    "path": "/p/provider.so"
  },
  "schema_version": "observed-crypto-v1.0",
  "stale": [
    {
      "detail": [],
      "events": 450,
      "generation": 0,
      "keys": 2
    }
  ],
  "target": {
    "cmdline": "t",
    "comm": "t",
    "container_id": "",
    "image_digest": "",
    "pid": 7
  },
  "window": {
    "actual_s": 1.0,
    "end_epoch": 1700000001.0,
    "planned_s": 1.0,
    "start_epoch": 1700000000.0
  }
}
